{
  "schema_version": "1.0.0",
  "source_document_id": "srcdoc_fixture_price_cmp_12",
  "source_id": "pps_g2b_contracts",
  "remote_record_id": "synthetic-price_cmp_12",
  "remote_version": "v1",
  "source_url": "https://fixtures.gurine.invalid/price_cmp_12",
  "published_at": "2025-06-25T00:00:00Z",
  "effective_at": "2025-06-25T00:00:00Z",
  "retrieved_at": "2026-01-15T03:10:00Z",
  "content_sha256": "0dbb5e6f65c5e820ea358c5f952cc951a95b19b1ad0598cfae50f0b80ad7328d",
  "schema_fingerprint": "fde483096a6cf4991b0dea6cc4b05650606c35716573a8d4f9fc790ae010bb94",
  "raw_object": {
    "raw_object_id": "raw_fixture_price_cmp_12",
    "byte_size": 659,
    "mime_declared": "application/json",
    "mime_detected": "application/json",
    "storage_class": "RAW_PRIVATE",
    "malware_scan_status": "CLEAN"
  },
  "license_status": "REVIEWED",
  "contains_personal_data": "NO",
  "fetch_attempt_id": "fetch_fixture_price_cmp_12",
  "metadata": {
    "synthetic": true,
    "fixture_name": "price_cmp_12",
    "payload_file": "price_cmp_12.payload.json"
  },
  "processing_status": "PARSED",
  "record_status": "CURRENT"
}
