{
  "schema_version": "1.0.0",
  "source_document_id": "srcdoc_fixture_vat_unknown",
  "source_id": "pps_g2b_contracts",
  "remote_record_id": "synthetic-vat_unknown",
  "remote_version": "v1",
  "source_url": "https://fixtures.gurine.invalid/vat_unknown",
  "published_at": "2025-07-12T00:00:00Z",
  "effective_at": "2025-07-12T00:00:00Z",
  "retrieved_at": "2026-01-15T03:10:00Z",
  "content_sha256": "205e36f0a182dc4e6d049860e860af0f49a8b6e87c2695217cd4d3528ebd163f",
  "schema_fingerprint": "fde483096a6cf4991b0dea6cc4b05650606c35716573a8d4f9fc790ae010bb94",
  "raw_object": {
    "raw_object_id": "raw_fixture_vat_unknown",
    "byte_size": 601,
    "mime_declared": "application/json",
    "mime_detected": "application/json",
    "storage_class": "RAW_PRIVATE",
    "malware_scan_status": "CLEAN"
  },
  "license_status": "REVIEWED",
  "contains_personal_data": "NO",
  "fetch_attempt_id": "fetch_fixture_vat_unknown",
  "metadata": {
    "synthetic": true,
    "fixture_name": "vat_unknown",
    "payload_file": "vat_unknown.payload.json"
  },
  "processing_status": "PARSED",
  "record_status": "CURRENT"
}
