{
  "schema_version": "1.0.0",
  "source_document_id": "srcdoc_fixture_amendment_escalation",
  "source_id": "pps_g2b_contracts",
  "remote_record_id": "synthetic-amendment_escalation",
  "remote_version": "v1",
  "source_url": "https://fixtures.gurine.invalid/amendment_escalation",
  "published_at": "2025-09-01T00:00:00Z",
  "effective_at": "2025-09-01T00:00:00Z",
  "retrieved_at": "2026-01-15T03:10:00Z",
  "content_sha256": "38bea9459b07668b752d128394447470bad19fe4866d0b30abfb679dcd4a0d3b",
  "schema_fingerprint": "fde483096a6cf4991b0dea6cc4b05650606c35716573a8d4f9fc790ae010bb94",
  "raw_object": {
    "raw_object_id": "raw_fixture_amendment_escalation",
    "byte_size": 889,
    "mime_declared": "application/json",
    "mime_detected": "application/json",
    "storage_class": "RAW_PRIVATE",
    "malware_scan_status": "CLEAN"
  },
  "license_status": "REVIEWED",
  "contains_personal_data": "NO",
  "fetch_attempt_id": "fetch_fixture_amendment_escalation",
  "metadata": {
    "synthetic": true,
    "fixture_name": "amendment_escalation",
    "payload_file": "amendment_escalation.payload.json"
  },
  "processing_status": "PARSED",
  "record_status": "CURRENT"
}
